,id,name,Arrondissemnt,Coor_x,Coor_y,Status,Dommages,Commentaire,Précision,Date
0,IY44AX,Eglise Saint-Morand,Altkirch,7.25289214851597,47.6243492028955,bon,100.0,,"Monument funéraire de Saint-Morand situé dans la nef. Sculpture représentant le Christ, Saint-Pierre et Saint-Paul, sur le côté Sud, à l'intérieur de la nef : inscription par arrêté du 28 juin 1937 ; Restes du monument Mont des Oliviers, situé près de l'église : inscription par arrêté du 24 juillet 1937",2018-12-31
1,IQWWSV,Fontaine de la Vierge,Altkirch,7.23726932351356,47.6236136787263,mauvais,10.0,Fleurons et petits pinacles manquants ou cassés. Bordure béton à reprendre partiellement. ,Façade occidentale (clocher compris) et le chevet : inscription par arrêté du 1er juin 1927 ; L'église Saint-Victor (cad. C 203) : inscription par arrêté du 13 septembre 2019,2018-12-31
2,IU5B8E,Hôpital Saint-Morand,Altkirch,7.25316827282321,47.6243133417764,mauvais,3.0,Portail extérieur : délitements et réparations anciennes au ciment. Peinture chapelle abîmée. ,Chapelle Saint-Christophe : inscription par arrêté du 10 janvier 1934,2018-12-31
3,IZAA72,Hôtel de Ville,Altkirch,7.23755262898471,47.6234271969293,moyen,0.0,"remontées capillaires, travaux d'entretien à prévoir sur la couverture",Façade et toiture : inscription par arrêté du 28 juin 1937,2018-12-31
4,I4T3FQ,Musée Sundgauvien,Altkirch,7.23743718303631,47.6233419142846,moyen,0.0,"Dernière porte au sommet de l'escalier, ancienne réparation du linteau défectueuse. ",Eglise : classement par liste de 1840,2018-12-31
5,I4VCS1,Presbytère catholique,Altkirch,7.23760861132055,47.6243875755481,bon,20.0,,Motif sculpté situé au-dessus de la porte dans la tourelle d'escalier : inscription par arrêté du 24 juillet 1937,2018-12-31
6,IRE8K9,Maison,Altkirch,7.23711059595799,47.6224614096658,mauvais,50.0,"Allèges+voutes en encorbellement+pierres éclatées en de nombreux endroits, réparations aléatoires.",Oriel : inscription par arrêté du 24 juillet 1937,2018-12-31
7,IJ21FO,Maison,Altkirch,7.23836594322914,47.6227247189799,bon,0.0,MH régulièrement repeint sans autorisation. A déprotéger.,Encadrement de fenêtre Renaissance au rez-de-chaussée (façade principale) : inscription par arrêté du 24 juillet 1937,2018-12-31
8,IYTCNH,Porte de ville (vieille),Altkirch,7.2368299805631,47.6241305932025,bon,,restauration complète 2015,Porte de ville (vieille) : inscription par arrêté du 28 juin 1937,
9,IAA7FF,Maison et moulin,Altkirch,7.07048906383658,47.6893498347171,moyen,,éléments de mécanisme en bois endommagés,Façades et toitures (cad. A 550) : inscription par arrêté du 9 novembre 1934 ; Roue à auges et mécanisme du moulin (cad. A 550) : classement par arrêté du 9 novembre 1984,2018-12-31
10,IFO7PX,Couvent de Luppach (ancien),Altkirch,7.33127623289399,47.5066468854361,bon,0.0,"micro algues, pb de ventilation","Passerelle métallique courbe, située au-dessus du canal de Briare, dans la continuité du boulevard des Belles-Manières (cad. AN domaine public, non cadastré) : inscription par arrêté du 3 mai 1999",2018-12-31
11,ISWV3A,Manoir de Flaxlanden (ancien),Altkirch,7.33734036059116,47.5295610395687,moyen,35.0,"Remontées capillaires extérieures, humidité persistante dans la cave, nez de marches cassés. ","Gisements préhistoriques de 850 m2 et de 1330 m2 (coupe forestière 19) , situés de part et d'autre du chemin des Carriers (cad. A 202) : classement par arrêté du 22 mars 1966",2018-12-31
12,IGN4PA,Eglise catholique Saint-Jacques-le-Majeur,Altkirch,7.26546350415028,47.5368769357656,mauvais,100.0,"consolidation maçonneries,traitement de la charpente,remontées capillaires,couverture en cours",Eglise Saint-Laurent (cad. AC 99) : classement par arrêté du 2 décembre 1986,2018-12-31
13,ITKULZ,Château (ruines),Altkirch,7.31800068781989,47.4936517686643,mauvais,85.0,gros travaux d'entretien et de mise en valeur des ruines à prévoir,Eglise (à l'exception de la nef) : classement par arrêté du 1er avril 1910,2018-12-31
14,IL1RVZ,Eglise catholique Saint-Bernard-de-Menthon,Altkirch,7.31500706592607,47.4946132217178,moyen,0.0,"enduits partiellement dégradé, travaux d'entretien 2016",L'église en totalité (cad. AS 92) : classement par arrêté du 12 juillet 2001,2018-12-31
15,IAT4GY,Chapelle Burnkirch (vocable Saint-Martin),Altkirch,7.2605818814415,47.6635569808511,bon,0.0,2013/14-PC restauration couverture (charpente y/c) + confortation assise. Intérieurs ? ,Chapelle dite Burnkirch (vocable Saint-Martin) (cad. F 383) : inscription par arrêté du 31 décembre 1958,2018-12-31
16,I229F5,Eglise catholique Saint-Martin (ancienne),Altkirch,7.26300792768965,47.673001268435,moyen,50.0,Défaut d'entretien façade et couverture,"Façade et toiture sur rue, y compris les ferronneries ; vestibule d'entrée ; escalier avec sa cage vitrée ; véranda avec son sol en mosaïque et ses parois de verre peint sur cour (cad. NU 33) : inscription par arrêté du 9 juillet 1981",2018-12-31
17,INB8VC,Installation de bains romains (vestiges),Altkirch,7.27839908371739,47.5061614353181,bon,65.0,dévégétalisation à prévoir,Installation de bain romaine (vestiges) : classement par arrêté du 17 janvier 1907,2018-12-31
18,IW7ZFK,Abbaye cistercienne (vestiges de l'ancienne),Altkirch,7.247589526116764,47.422488287566196,moyen,0.0,"enduits ciment, peintures acryliques, couverture remaniée","Logis et ensemble du domaine, y compris la rabine (cad. P 228, 229, 238, 250 à 259, 261 à 263 ; Q 127) : inscription par arrêté du 29 avril 1993",2018-12-31
19,INX44Q,Tribunal (ancien),Altkirch,7.38048582624671,47.4652741283928,moyen,0.0,"travaux de couverture, enduit, menuiserie sur la 1/2 à prévoir",Croix du cimetière (cad. AD 24) : inscription par arrêté du 18 juillet 1973,2018-12-31
20,I0ISBA,Château de Morimont (ruines),Altkirch,7.21428796232701,47.4455875288498,mauvais,80.0,"Non entretenu, nécessite des travaux de restauration.",Eglise : classement par arrêté du 21 mars 1910,2018-12-31
21,I989M7,Chapelle Saint-Martin ,Altkirch,7.38304355513534,47.4843310529449,bon,25.0,"travaux de restauration des enduits+couverture en cours, mousse verte au sol à l'intérieur",La tour : classement par liste de 1889 et par arrêté du 1er décembre 1903,2018-12-31
22,I6RWSF,Chapelle Saint-Martin,Altkirch,7.34255225530207,47.4729005685392,bon,40.0,entretenue,"Eglise, aire de l'ancien cloître et bâtiments conventuels qui l'entourent (cad. PX 225, 238, 285) : classement par arrêté du 29 décembre 1983",2018-12-31
23,IMXCY3,Château de Reinach,Altkirch,7.22466219001184,47.5979083101248,mauvais,,"menuiseries,couverture, grilles et élévations à restaurer. accès au château impossible ",Salon central au rez-de-chaussée et salon immédiatement adjacent au sud avec leur décor ; jardin ; trois portails à grilles en fer forgé (cad. 2 78) : inscription par arrêté du 6 mars 1990 - Façades et toitures du château ; cadran solaire en polyèdre dans le jardin (cad. 2 78) : classement par arrêté du 4 juillet 2000,
24,I5CPQI,Enceinte protohistorique de Britzgyberg,Altkirch,7.27294960692065,47.6741085539471,bon,35.0,vestiges archéo,"Totalité des vestiges, y compris le sol (cad. 13 1 à 19, 257 à 273) : inscription par arrêté du 22 décembre 1989, modifié par arrêté du 1er décembre 1995",2018-12-31
25,ISPGF8,Motte féodale,Altkirch,7.10869258525827,47.6206065975417,,70.0,,"Site de l'enceinte médiévale (cad. C 425, 427) : inscription par arrêté du 11 septembre 1997",2018-12-31
26,I3RBOS,Hôtel de Ville,Altkirch,7.31687649681505,47.4927741980348,moyen,95.0,"restauration des enduits, rdc à restaurer (projet 2016) pour musées ? ",Château de Roquemartine (vestiges du) : inscription par arrêté du 28 septembre 1926,2017-12-31
27,I52M53,Château,Altkirch,7.23946853101942,47.6586283292989,mauvais,0.0,"restauration de la couverture+ charpente+enduits, infiltration d'eau, pignon envahi par végétaux","L'église en totalité avec sa sacristie, le mobilier qui y est intégré (confessionnaux, baldaquin, armoires) et son placître, tel que délimité en rouge sur le plan annexé à l'arrêté (cad. AC 120) : inscription par arrêté du 23 février 2016",2018-12-31
28,I1YOGZ,Parc de Reinach,Altkirch,7.22365265938518,47.5971030293029,moyen,10.0,chalet restaurer en 2015.hangar a charette en cours de restauration. glacier et grenier en périls,"Parc sur l'ensemble de son emprise, y compris le mur de clôture et les éléments architecturaux (cad. 1 370) : inscription par arrêté du 5 septembre 1996",2018-12-31
29,I8LTL1,Moulin Bas,Altkirch,7.26768966423594,47.6411800709934,moyen,,"restauration du pont à prévoir. Menuiseries, bardage, couverture défecteux","Le domaine de Bélon, soit le logis du 18e siècle en totalité, le pavillon du 19e en totalité, la chapelle en totalité, le portail sud, l'emprise du jardin délimité au nord par la chapelle, au sud par la balustrade et la rive, à l'est par le mur de clôture et à l'ouest par le château, le sol d'assiette des parcelles YL 81, 83 et 84, les murs de clôture du domaine avec ses batteries, le magasin à huîtres à l'ouest du château, les bassins ostréicoles en concession sur le Bélon, tels que délimités sur les plans joints à l'arrêté (cad. YL 81, 83 et 84 ; YN 35 ; domaine public maritime 30. Les bassins ostréicoles sont situés sur le domaine public maritime, feuille n°2, parcelles 24-551 J, 25-57, 37-49, 37-50, 38-511, 38-52 J, 38-531 F et 38-51) : inscription par arrêté du 11 mai 2017",
30,IXCFGF,Eglise catholique Saint-Sébastien,Altkirch,7.3085954782611,47.6436056872598,bon,10.0,"enduit très étanche, intérieur non visité (remontées capillaires?), couverture et EP refaites",Eglise (cad. 1 57) : inscription par arrêté du 10 février 1999,2018-12-31
31,IHU3YA,Chapelle Saint-Brice,Altkirch,7.42884201046687,47.5000622645325,bon,0.0,restaurée en 2014,La chapelle avec le bâtiment de la ferme (logis et partie agricole) et la totalité du sol de la parcelle (cad. 15 7) : inscription par arrêté du 9 mars 2006,2018-12-31
32,IX7HL2,"Ferme ""La Vacherie""",Altkirch,7.22618992886128,47.4478149279731,mauvais,15.0,bâtiment d'habitation:versement+flambement important+fissures. ferme:plancher à 85%dégradé,"La ferme en totalité, grange, étable et corps de logis (cad. B 106) : inscription par arrêté du 22 juin 2007",2018-12-31
33,IXN2UY,Maison et sa tour sur la muraille,Altkirch,7.23592108117656,47.6235979859768,bon,20.0,restauration complète 2014,"Les façades, les toitures et le portique ; le hall avec son comptoir et la première rue ; les appartements 101, 116, 128, 131, 132, 133, 134 (cad. D 1319) : inscription par arrêté du 26 novembre 1993 - Les façades et les toitures de l'ancienne chaufferie ainsi que son portique constitué de trois piliers et d'une poutre (cad. D 2533) : inscription par arrêté du 16 juillet 2007",2018-12-31
34,IED5CG,Chapelle Saint-Brice,Altkirch,7.31250915991026,47.6115726571269,bon,5.0,travaux de restauration réalisé en 2016,"La chapelle Saint-Brice en totalité, sur sa parcelle assiette, réserve archéologique, sise route de Schwoben à Hausgauen (cad. 06 97) : inscription par arrêté du 24 septembre 2015",2018-12-31
