,id,name,Arrondissemnt,Coor_x,Coor_y,Status,Dommages,Commentaire,Précision,Date
247,IT1AOE,Enceinte fortifiée urbaine (vestiges),Colmar-Ribeauvillé,7.37168818043196,48.2323170240768,bon,0.0,,"Vestiges de l'enceinte fortifiée tels qu'ils figurent sur le plan joint au dossier (cad. 1 2, 3, 9, 13, 14, 31 à 34, 36, 88, 56, 93/12, 96/57, 98/57, 99/85, 105/11 ; 2 2, 3, 5, 6, 8, 9, 290/12, 13, 23 à 27, 31 à 33, 182 à 186, 188 à 194, 199, 205, 207, 210, 213, 215 à 217, 219, 221 à 223, 227/200, 232/14, 245/202, 248/18, 250/21, 273/7) : inscription par arrêté du 10 juin 1993",2018-12-31
248,IJMI7F,Château Burrus (ancien),Colmar-Ribeauvillé,7.22399754478205,48.2628685264762,péril,100.0,Château non entretenu. Défaut de sécurisation du site. Intrusions régulières. Départs de feu en 2017,Eglise (cad. B 302) : inscription par arrêté du 27 décembre 1973,2018-12-31
249,I44GJG,Tour des mineurs,Colmar-Ribeauvillé,7.1619557816082,48.2311203028234,bon,40.0,,Les deux cellules au sous-sol (cad. D 219) : inscription par arrêté du 19 août 1993 - Façades et toitures (cad. D 219) : classement par arrêté du 13 août 1998,2018-12-31
250,IVT1ZP,Grenier de la dîme (ancien),Colmar-Ribeauvillé,7.2625989609742,48.1382457890176,bon,100.0,- Rénovation récente.,Façade : inscription par arrêté du 12 octobre 1929,2018-12-31
251,IZHJFR,Château de Reichenberg,Colmar-Ribeauvillé,7.33753188390261,48.214717548848,bon,0.0,"Reprises ponctuelles couverture, charpente, maçonnerie à prévoir. Antériorités administratives?","Façades et toitures ; plaque de la cheminée du rez-de-chaussée mentionnant Claude Bichat ; cheminée de la chambre à l'étage avec sa plaque ; auge-abreuvoir, séparée de la maison par le chemin (cad. AD 109) : inscription par arrêté du 18 mai 1990",2018-12-31
252,I3GII9,Maison du maire Eberlin (ancienne),Colmar-Ribeauvillé,7.29744229899203,48.1672248489404,moyen,0.0,"Cave à rafraîchir - Tvx ponctuels sur Pignon : rives, grès, peinture des volets",Façades et toitures du corps principal ; cave ; tourelle d'escalier ; façades et toitures du corps d'entrée (cad. 2 221) : inscription par arrête du 11 juillet 1995,2018-12-31
253,ITNK2R,Synagogue,Colmar-Ribeauvillé,7.29176251118227,48.0720060364316,bon,,,"Le groupe sculpté avec son socle (cad. non cadastré, domaine public) : inscription par arrêté du 18 août 2006",2018-12-31
254,IUGI0J,Monument aux morts,Colmar-Ribeauvillé,7.32455272408068,48.1448151493006,bon,0.0,Nombreuses traces de martelage.,Monument avec son socle (cad. 3 89) : inscription par arrêté du 21 juin 1996 modifié par arrêté du 9 octobre 1996 modifié par arrêté du 9 décembre 1996,2018-12-31
255,IHJPF1,Eglise protestante Saint-Martin,Colmar-Ribeauvillé,7.47877125054434,48.1249456423231,,30.0,,"Ensemble des parties anciennes antérieures au 20e siècle, y compris les vitraux du 16e siècle de la sacristie nord, les inscriptions peintes et les vestiges archéologiques conservés autour de l'édifice (cad. 9 117) : inscription par arrêté du 19 février 1996",2018-12-31
256,IFMN85,Ancienne cour domaniale de l'abbaye de Pairis dite domaine du Bouxhof,Colmar-Ribeauvillé,7.30720004955784,48.1517922592194,bon,,,Base de croix : inscription par arrêté du 16 juin 1926,2018-12-31
257,IOBF12,Eglise catholique Saints-Philippe-et-Jacques,Colmar-Ribeauvillé,7.29534593056506,48.0184923977743,bon,50.0,Grès détériorés en partie basse. Surcharge d'enduit des panneaux miroirs.,"Clocher-porche (ancien clocher-choeur) , chapelle baptismale (ancienne sacristie) et ensemble des vestiges enterrés ou non du mur d'enceinte (cad. 4 34) : inscription par arrêté du 9 décembre 1996",2018-12-31
258,IBG1OC,Scierie Vincent,Colmar-Ribeauvillé,7.23663835272411,48.2662853571631,bon,0.0,Fissuration maçonnerie (briques) près du portail en bois. ,Ruines du château (cad. AN 69) : classement par arrêté du 19 juillet 1977,2018-12-31
259,IJUVLK,Villa Boeschlin,Colmar-Ribeauvillé,7.35595428019299,48.0721236090358,moyen,20.0,Peinture écaillée sur socle. Edicule SO se tassant + fissure verticale. Intérieurs + arrière non vus,La chapelle en totalité (cad. B1 389) : inscription par arrêté du 7 juin 2006,2018-12-31
260,IU3PLG,Jardin du Château Bas des Ribeaupierre,Colmar-Ribeauvillé,7.31425178624655,48.1971792607857,mauvais,2.0,"vivier supérieur et intermédiaire, fontaines & statues sans entretien","Ensemble de la partie haute du jardin, comprenant notamment : le vivier supérieur et le banc le bordant ; la fontaine de la terrasse supérieure ; le vivier de la terrasse intermédiaire ; les statues de Jean-Joseph-Ignace Brosch représentant Apollon, Diane, Vénus et Flore ; les murs de soutènement des terrasses ; les escaliers d'accès au jardin ; le mur de clôture donnant sur la rue du Château (cad. 29 560/140) : inscription par arrêté du 24 décembre 1997",2014-12-31
261,IC9FQD,Gare ferroviaire,Colmar-Ribeauvillé,7.40238458148709,48.2216326164457,péril,0.0,Édifice victime d'un incendie en 2010. Aucun travaux depuis.,Façades et toitures de l'ensemble des bâtiments ; hall des voyageurs ; quais (cad. 22 234) : inscription par arrêté du 30 septembre 1997,2018-12-31
262,IU7EBM,Enceinte fortifiée urbaine (vestiges),Colmar-Ribeauvillé,7.32038723343993,48.1687788343795,moyen,10.0,Enduit non adapté (10 rue schlossberg). ,"Façade, hormis la surélévation crépie, et toiture hexagonale de la tour sud-est, située 46 rue du Schlossberg (cad. 9 102b) ; façade et toiture hexagonale de la tour nord-est, située au lieudit Village, 10 rue du Schlossberg (cad. 9 51) ; vestiges de l'enceinte fortifiée situés au lieudit Village, 49 rue de la Fontaine (cad. 9 1) : inscription par arrêté du 18 septembre 1997, modifié par arrêté du 25 novembre 1997",2018-12-31
263,I93EHW,Hôtel de ville,Colmar-Ribeauvillé,7.30926647878069,48.1795564621299,mauvais,50.0,Enduits non adaptés. Remontées capillaires et efflorescences salins (soubassement notamment),"Croix grecque, sur la petite place (cad. C 81) : inscription par arrêté du 22 juillet 1963",2018-12-31
264,I6XJKJ,Poêle du conseil (ancien),Colmar-Ribeauvillé,7.31154083656888,48.179956193372,moyen,10.0,Intérieurs non visités. Prévoir révision couverture. Soubassements cimentés.,"Façades ; toiture, y compris la charpente ; pièce nord-est ; caveau (cad. 2 103) : inscription par arrêté du 25 mai 1999",2018-12-31
265,I7PTCV,Presbytère protestant,Colmar-Ribeauvillé,7.30937688542465,48.1793759575659,bon,,Intérieurs non visités. ,"Prieuré comprenant le logis fortifié avec les pièces suivantes et leur décor de boiseries et cheminées (premier étage : chambre verte et chambre Ouest ; deuxième étage : chambres Est et Ouest) et la tour Nord, à l'exclusion de l'appendice de 1912 (cad. A 882) : inscription par arrêté du 7 décembre 1992",
266,IY7AYS,Château des Ifs,Colmar-Ribeauvillé,7.28727290510471,48.1351956621859,bon,10.0,"Tvx réalisés sur dépendances, passage d'entrée, murs de clôture. Intérieurs non visités.",Le chevalement sud (cad. 9 289) : inscription par arrêté du 22 octobre 1992,2018-12-31
267,IJMIFT,Château Lacour (ancien),Colmar-Ribeauvillé,7.17242353633882,48.242956785406,bon,,Int. non vus. Traitement des grilles à prévoir. Quelques éléments de corniche manquants. ,Cheminée ; pilier du premier étage (cad. AB 122) : inscription par arrêté du 26 octobre 1995,2018-12-31
268,IPBZGK,Commanderie des Templiers (ancienne),Colmar-Ribeauvillé,7.34438185304851,48.2091436884669,bon,45.0,entretenu,La motte castrale : classement par arrêté du 11 mars 1983,2018-12-31
269,IAR0T0,Maison Bohn,Colmar-Ribeauvillé,7.35969639273369,48.2048249201601,bon,100.0,Face intérieure avec colonne torse non visitée.,Eglise (ruines de l'ancienne) (cad. A 171) : classement par arrêté du 14 octobre 1969,2018-12-31
270,ISMVXP,Enceinte fortifiée urbaine (vestiges),Colmar-Ribeauvillé,7.27446367070997,48.0861559175167,bon,0.0,"entretien régulier à prévoir (végétaux, arase sacrificielle)",Eglise (restes) : classement par arrêté du 7 décembre 1914,2018-12-31
271,I6LJVK,Eglise catholique Saint-Michel,Colmar-Ribeauvillé,7.3287203689042,48.0178912255016,bon,0.0,"Choeur: peinture qui se détache en partie basse, revêtement sol étanche en pied de façade.","Les vestiges médiévaux et Renaissance : tour-porche, vestige du bas-côté sud, choeur, chapelle latérale nord et passage daté 1550 (cad. 5 47) : inscription par arrêté du 29 octobre 2001",2018-12-31
272,ICE4QT,Pont de la Timbach,Colmar-Ribeauvillé,7.23401585294206,48.2644294028311,moyen,,Purge interventions au ciment. Traitement biocide et dévégétalisation à prévoir.,"Le pont situé sur la rivère Liepvrette, en totalité (cad. non cadastré) : inscription par arrêté du 23 décembre 2002",2018-12-31
273,IF7STK,Ferme Saint-Gilles,Colmar-Ribeauvillé,7.26315912066912,48.0725686366897,bon,10.0,"Bon état général, centre équestre","Le château d'Entraygues en totalité, y compris les terrasses, les communs avec le fournil, la chapelle et la grange. Il est situé sur les parcelles n°140, 141, 142 et 143 figurant au cadastre section AY : inscription par arrêté du 20 mai 2015",2018-12-31
274,I7A92M,Maison,Colmar-Ribeauvillé,7.27202668872182,48.0996730711762,,0.0,,Eglise Notre-Dame d'Entraigues (cad. ZB 415) : inscription par arrêté du 12 avril 1972,2018-12-31
275,IP1QC3,Cimetière israélite,Colmar-Ribeauvillé,7.31464145849073,48.0119594431595,moyen,50.0,Traitement de la végétation à prévoir. Mur de clôture cimenté? ,"Site protohistorique de Chastel (cad. YB 11, 13, 15, 16, 18, 177, 178, 205, 207, 219, 222) : inscription par arrêté du 30 septembre 1991",2018-12-31
276,IP821E,Loge maçonnique,Colmar-Ribeauvillé,7.35950791627912,48.0696849702823,moyen,10.0,travaux d'entretien des menuiseries et reprise couverture à prévoir,"L'immeuble en totalité, y compris sa grille et son mur de clôture, ainsi que les huisseries et les éléments immeubles par destination (cad. VY 63) : inscription par arrêté du 9 février 2007",2018-12-31
277,IP6AX7,Sanctuaire Notre-Dame de Dusenbach,Colmar-Ribeauvillé,7.29309373820749,48.2045905384721,bon,,"lieu de pélerinage, entretenu","Hôtel et dépendances : totalité de l'hôtel de la Préfecture proprement dit, des deux pavillons et de la grille d'entrée, des anciennes écuries, du parc ; bâtiment initial des bureaux : façades et toitures, hall d'entrée, escalier d'honneur, ancienne salle du conseil général (cad. BI 231) : inscription par arrêté du 4 mai 2000",2012-09-26
278,IN8165,Château Hattstatt-Schauenbourg,Colmar-Ribeauvillé,7.20112065705285,48.0360868136017,bon,,Intérieurs non vus. ,"Le corps principal du château et le bâtiment en retour, composant le château historique, en totalité, ainsi que les vestiges du rempart compris dans l'élévation postérieure du bâtiment du réfectoire ; le sol de la cour et du jardin (cad. 01 152) : inscription par arrêté du 14 décembre 2009",
279,IL15O0,Chalet Hôpital,Colmar-Ribeauvillé,7.14346415425596,48.2309083712036,moyen,70.0,"travaux de gros-œuvre à prévoir pour les piscines, étanchéité des bassins, entretien des volets  ","Bâtiments de l'hôtel, y compris les décors (cad. AB 5) : inscription par arrêté du 4 juillet 1996",2018-12-31
280,IGV2ED,Eglise Notre-Dame-de-l'Assomption,Colmar-Ribeauvillé,7.319649903941201,48.084654212053536,,40.0,,"Les carrières de meules de moulins dites la "" Pierre au Mort "" et la "" Tanière au Renard "" et le sol des parcelles B 135 et B 141 sur lesquelles elles se trouvent : classement par arrêté du 11 mars 2009",2018-12-31
281,I8BXKX,Cimetière militaire,Colmar-Ribeauvillé,7.1077514469056,48.1487369382409,bon,40.0,travaux d'entretien dans le cadre du centenair,Chapelle Sainte-Croix ou des Pénitents Blancs (cad. K 249) : inscription par arrêté du 10 décembre 1949,2018-12-31
282,IPSACU,Eglise catholique Notre-Dame des sept Douleurs,Colmar-Ribeauvillé,7.28502119280006,48.1364561284718,moyen,30.0,"enduits, pierre de taille, couverture défectueux",,2018-12-31
